{
  "$schema": "https://vxsan.com/schemas/finance-workflow-parameter-ownership-v1.json",
  "schema_version": 1,
  "contract_status": "SPEC_ONLY",
  "parameter_node_types": [
    "n8n-nodes-base.editFields",
    "n8n-nodes-base.set"
  ],
  "workflow_globs": [
    "integrations/n8n/setup-workflows/*.json",
    "integrations/n8n/workflows/*.json"
  ],
  "global_contract_sources": [
    {
      "path": "config/agent-providers.json",
      "selectors": [
        "profiles.*.agent_provider",
        "providers.*.adapter_package",
        "providers.*.normal_model",
        "providers.*.normal_reasoning_effort",
        "providers.*.exception_model",
        "providers.*.exception_reasoning_effort"
      ]
    },
    {
      "path": "integrations/n8n/generated/application-contract-bundle.json",
      "selectors": [
        "resolver_maps.*.entries.*.value.*",
        "source_contracts.*.contract.*",
        "config_versions.*.*",
        "ai_policy_contracts.*.contract.*"
      ]
    },
    {
      "path": "config/actual-note-contract.json",
      "selectors": [
        "document_root"
      ]
    },
    {
      "path": "config/document-processing.json",
      "selectors": [
        "default_policy",
        "providers.*.code"
      ]
    }
  ],
  "credential_identifier_sources": [
    {
      "path": "integrations/n8n/pipeline-registry.json",
      "selectors": [
        "custom_nodes.credentials"
      ]
    }
  ],
  "forbidden": {
    "credential_key_patterns": [
      "credential",
      "password",
      "passphrase",
      "token",
      "secret",
      "cookie",
      "api[_-]?key",
      "private[_-]?key",
      "access[_-]?token",
      "refresh[_-]?token"
    ],
    "secret_value_patterns": [
      "^Bearer\\s+",
      "^eyJ[A-Za-z0-9_-]{16,}\\.",
      "^-----BEGIN [A-Z ]+-----",
      "^(?:sk|pk)-[A-Za-z0-9_-]{16,}$"
    ],
    "protected_field_names": [
      "account",
      "account_id",
      "actual_account_id",
      "actual_id",
      "amount",
      "command",
      "commit",
      "credential",
      "credential_id",
      "deduplication_key",
      "folder",
      "folder_id",
      "model",
      "path",
      "prompt",
      "provider",
      "reconciliation_state",
      "secret",
      "source_id",
      "sender",
      "subject",
      "token",
      "transaction_amount",
      "url"
    ]
  },
  "workflows": {
    "01-outlook-finance-acquisition.json": {
      "nodes": {
        "Acquisition Parameters": {
          "caller_fields": {
            "run_id": "string",
            "source_code": "string",
            "folder_id": "string",
            "senders": "array",
            "subjects": "array",
            "window_start": "string",
            "run_upper_bound": "string",
            "onedrive_parent_id": "string",
            "max_messages": "number"
          },
          "fields": {
            "archive_readback_required": {
              "category": "workflow_local_constant",
              "type": "boolean"
            },
            "max_messages": {
              "category": "workflow_local_input",
              "type": "number",
              "expression_allowed": true
            },
            "subject_match": {
              "category": "workflow_local_constant",
              "type": "string"
            }
          }
        }
      }
    },
    "03-shared-statement-pipeline.json": {
      "nodes": {
        "Statement Pipeline Parameters": {
          "caller_fields": {
            "run_id": "string",
            "source_code": "string",
            "message_id": "string",
            "document_sha256": "string",
            "onedrive_item_id": "string",
            "manifest_onedrive_parent_id": "string",
            "config_version": "string",
            "actual_file_id": "string",
            "account_id": "string",
            "card_code": "string",
            "cashback_close_required": "boolean",
            "period_key": "string",
            "trigger_kind": "string",
            "attachment_id": "string",
            "source_attachment_id": "string"
          },
          "fields": {
            "actual_writer_workflow": {
              "category": "workflow_local_constant",
              "type": "string"
            },
            "pipeline_contract": {
              "category": "workflow_local_constant",
              "type": "string"
            },
            "source_mutation_forbidden": {
              "category": "workflow_local_constant",
              "type": "boolean"
            }
          }
        }
      }
    },
    "09-ai-proposal.json": {
      "nodes": {
        "Agent Proposal Parameters": {
          "caller_fields": {
            "policy_id": "string",
            "unresolved": "array"
          },
          "fields": {
            "proposal_only": {
              "category": "workflow_local_constant",
              "type": "boolean"
            },
            "provider_selection": {
              "category": "workflow_local_constant",
              "type": "string"
            },
            "supported_providers": {
              "category": "global_generated_contract",
              "type": "string",
              "source": {
                "path": "config/agent-providers.json",
                "selector": "profiles.*.agent_provider"
              }
            }
          }
        }
      }
    },
    "14-local-pdf-extraction.json": {
      "nodes": {
        "PDF Extraction Parameters": {
          "caller_fields": {
            "document_id": "string",
            "source_sha256": "string",
            "source_code": "string",
            "card_code": "string"
          },
          "fields": {
            "document_profile": {
              "category": "workflow_local_constant",
              "type": "string"
            },
            "minimum_characters": {
              "category": "workflow_local_constant",
              "type": "number"
            },
            "minimum_printable_ratio": {
              "category": "workflow_local_constant",
              "type": "number"
            }
          }
        },
        "Ready for Deterministic Parser": {
          "caller_fields": {
            "document_id": "string",
            "source_sha256": "string",
            "extracted_text": "string",
            "validation_status": "string"
          },
          "fields": {
            "parser": {
              "category": "workflow_local_constant",
              "type": "string"
            },
            "parser_version": {
              "category": "workflow_local_constant",
              "type": "string"
            },
            "provenance": {
              "category": "derived_state",
              "type": "array",
              "expression_allowed": true
            },
            "result_ref": {
              "category": "derived_state",
              "type": "string",
              "expression_allowed": true
            },
            "validation_status": {
              "category": "derived_state",
              "type": "string"
            }
          }
        }
      }
    },
    "20-actual-outbox-apply.json": {
      "nodes": {
        "Actual Writer Parameters": {
          "caller_fields": {
            "outbox_row": "object",
            "manifest": "object",
            "verification": "object",
            "delta_artifact_item_id": "string",
            "delta_artifact_etag": "string"
          },
          "fields": {
            "exact_readback_required": {
              "category": "workflow_local_constant",
              "type": "boolean"
            },
            "lease_required": {
              "category": "workflow_local_constant",
              "type": "boolean"
            },
            "writer_contract": {
              "category": "workflow_local_constant",
              "type": "string"
            }
          }
        }
      }
    },
    "21-subscription-agent-adapter.json": {
      "nodes": {
        "Subscription Provider Parameters": {
          "caller_fields": {
            "policy_class": "string",
            "job_id": "string",
            "idempotency_key": "string",
            "unresolved": "array",
            "operation_code": "string",
            "email_evidence": "boolean",
            "archive_sha256": "string",
            "evidence_replay_keys": "array",
            "archive_identity_keys": "array",
            "archive_item_ids": "array",
            "policy_id": "string",
            "policy_sha256": "string",
            "config_sha256": "string",
            "output_schema_sha256": "string"
          },
          "fields": {
            "adapter_contract": {
              "category": "workflow_local_constant",
              "type": "string"
            },
            "codex_auth_mode": {
              "category": "workflow_local_constant",
              "type": "string"
            },
            "codex_exception_model": {
              "category": "global_generated_contract",
              "type": "string",
              "source": {
                "path": "config/agent-providers.json",
                "selector": "providers.CODEX_SUBSCRIPTION.exception_model"
              }
            },
            "codex_exception_reasoning_effort": {
              "category": "global_generated_contract",
              "type": "string",
              "source": {
                "path": "config/agent-providers.json",
                "selector": "providers.CODEX_SUBSCRIPTION.exception_reasoning_effort"
              }
            },
            "codex_normal_model": {
              "category": "global_generated_contract",
              "type": "string",
              "source": {
                "path": "config/agent-providers.json",
                "selector": "providers.CODEX_SUBSCRIPTION.normal_model"
              }
            },
            "codex_normal_reasoning_effort": {
              "category": "global_generated_contract",
              "type": "string",